{
  "$schema": "http://json-schema.org/draft-07/schema#",
  "$id": "https://clawrocket.dev/contracts/editorial-room/v0/point_note_block.schema.json",
  "title": "PointNoteBlock",
  "description": "Working notes scoped to a specific point within a Piece. Piece-local until promoted via propose_update. See EDITORIAL_ROOM_CONTRACT.md §4.1. NOTE: §4.1 enum {thought, claim, evidence, question, counterpoint} differs from design/03_points_outline.md (which uses {claim, evidence, thought, question, counter, other}); reconcile in a contract update.",
  "type": "object",
  "additionalProperties": false,
  "required": [
    "id",
    "piece_id",
    "point_ref",
    "setup_version",
    "type",
    "body_md",
    "created_at",
    "updated_at",
    "created_by_user_id",
    "promoted_to"
  ],
  "properties": {
    "id": { "type": "string", "minLength": 1, "description": "ULID." },
    "piece_id": { "type": "string", "minLength": 1 },
    "point_ref": {
      "type": "string",
      "minLength": 1,
      "description": "Slug of the point this note is about."
    },
    "setup_version": {
      "type": "integer",
      "minimum": 1,
      "description": "Setup version at time of writing (staling key)."
    },
    "type": {
      "type": "string",
      "enum": ["thought", "claim", "evidence", "question", "counterpoint"]
    },
    "body_md": {
      "type": "string",
      "minLength": 1,
      "description": "Freeform Markdown."
    },
    "created_at": { "type": "string", "format": "date-time" },
    "updated_at": { "type": "string", "format": "date-time" },
    "created_by_user_id": { "type": "string", "minLength": 1 },
    "promoted_to": {
      "anyOf": [
        { "type": "null" },
        {
          "type": "object",
          "additionalProperties": false,
          "required": ["kind", "target_slug"],
          "properties": {
            "kind": { "type": "string", "enum": ["point", "claim_ledger"] },
            "target_slug": { "type": "string", "minLength": 1 }
          }
        }
      ],
      "description": "Set when user promotes the note to a durable point page or claim ledger entry."
    }
  }
}
