[
  {
    "id": "01HXYZNOTE001AAAAAAAAAAAAA",
    "piece_id": "piece_01HXYZ789ABC",
    "point_ref": "point/embracer-mg-reclassification-load-bearing",
    "setup_version": 7,
    "type": "claim",
    "body_md": "MG itself is now reclassified as a conditional liability under the post-Embracer accounting framework. That's the structural change, not the writedown itself.",
    "created_at": "2026-04-30T11:32:00.000Z",
    "updated_at": "2026-04-30T11:32:00.000Z",
    "created_by_user_id": "user_local_joseph",
    "promoted_to": null
  },
  {
    "id": "01HXYZNOTE002BBBBBBBBBBBBB",
    "piece_id": "piece_01HXYZ789ABC",
    "point_ref": "point/embracer-mg-reclassification-load-bearing",
    "setup_version": 7,
    "type": "evidence",
    "body_md": "Embracer Q3 8-K, pp. 14-16: explicit reclassification language. Devolver Q4 prelim $5 echoes the change. Take-Two K-1 silent (different acct treatment).",
    "created_at": "2026-04-30T11:38:00.000Z",
    "updated_at": "2026-04-30T11:38:00.000Z",
    "created_by_user_id": "user_local_joseph",
    "promoted_to": {
      "kind": "claim_ledger",
      "target_slug": "claims_ledger/embracer-mg-reclassified-q3-2025"
    }
  },
  {
    "id": "01HXYZNOTE003CCCCCCCCCCCCC",
    "piece_id": "piece_01HXYZ789ABC",
    "point_ref": "point/embracer-mg-reclassification-load-bearing",
    "setup_version": 7,
    "type": "counterpoint",
    "body_md": "Annapurna staffer (background): this is overstated — they're still signing pre-Embracer-shape deals at unchanged MG ratios. The reclassification may not be universal.",
    "created_at": "2026-04-30T11:41:00.000Z",
    "updated_at": "2026-04-30T11:41:00.000Z",
    "created_by_user_id": "user_local_joseph",
    "promoted_to": null
  }
]
